{
  "benchmark_version": "1.0.0",
  "container_digests": {
    "cpp-closed_book": "sha256:2f01b7210760474f36e8b5359309cc6273931bdb2a0df3dbe4d58fed8a728e7e",
    "cpp-delta": "sha256:ca0fa5f6b8a880627df7ffe0297c79bfbdabe898736a3566f893697b59048119",
    "cpp-open_book": "sha256:2978aa2447c462ddaed16dc0cf0b9cd7f78df0cac5e40c02d4e518ca6eaac8d8",
    "go-closed_book": "sha256:71722f244f58d669cbee3772a077021721a278f64f7fd633dbdde131ca3766e4",
    "go-delta": "sha256:d58e72e310275dff6c15c0c8e9df469611a11f5125227c3712da86a78c49ea20",
    "go-open_book": "sha256:c87a171ac826a6fce48478dcb74f21345d2cce8038a39d5e0853964b50af03b9",
    "rust-closed_book": "sha256:5d05ad7853c1f76eb97706ca828bca0385813dbad3c681d06bd2aa399dac946d",
    "rust-delta": "sha256:c59c0996daeee6f529a279764017f2ed6cfc7403d75e173e4eaede5fe878f78e",
    "rust-open_book": "sha256:e32684b27b95e909348334896a68f812d810a485ed03241b4d419b1b673bd475"
  },
  "fixture_set_hash": "sha256:30877432d1026706d7e805da846a32c3bb81e3c29b62179273c8eb5bb682575e",
  "harness_version": "0.4.2",
  "runs": []
}
